{
  "kind": "image-artifact",
  "schema_version": 1,
  "artifact_id": "external-debian13-example",
  "version": "external-2026-09-23",
  "disk": {"path": "disk.qcow2", "format": "qcow2", "sha256": "bbbbbbbbbbbbbbbbbbbbbbbbbbbbbbbbbbbbbbbbbbbbbbbbbbbbbbbbbbbbbbbb", "size_bytes": 1073741824, "virtual_size_bytes": 8589934592, "self_contained": true},
  "guest": {"architecture": "amd64", "firmware": "bios", "cloud_init": "unknown", "guest_agent": "unknown"},
  "build": {"origin": "external"},
  "checks": [
    {"id": "format", "scope": "static", "status": "passed", "evidence_ref": null},
    {"id": "self-contained", "scope": "static", "status": "passed", "evidence_ref": null},
    {"id": "first-boot", "scope": "post-cleanup-disposable", "status": "unknown", "evidence_ref": null}
  ]
}
